{
  "$schema": "https://json-schema.org/draft/2020-12/schema",
  "$id": "ziwei-bible/profile.schema.json",
  "title": "ZiWei Bible Profile",
  "type": "object",
  "required": ["profileId", "name"],
  "properties": {
    "$schema": { "type": "string" },
    "profileId": { "type": "string" },
    "name": { "type": "object", "additionalProperties": { "type": "string" } },
    "description": { "type": "object", "additionalProperties": { "type": "string" } },
    "timeConvention": {
      "type": "string",
      "enum": ["civil", "true-solar", "local-mean-solar"]
    },
    "dayBoundary": {
      "type": "string",
      "enum": ["midnight", "zi-hour"]
    },
    "leapMonthPolicy": {
      "type": "string",
      "enum": ["mid-month", "same-as-normal", "split", "next-month"]
    },
    "periodRules": {
      "type": "object",
      "description": "目前支援 ageMethod: virtual-age",
      "properties": {
        "ageMethod": { "type": "string", "enum": ["virtual-age"] }
      }
    },
    "ruleOverrides": {
      "type": "object",
      "description": "canonical ruleId -> variant ruleId（所有 variant 統一由此機制控制）",
      "additionalProperties": { "type": "string" }
    },
    "_reserved": {
      "type": "object",
      "description": "未實作或保留之控制欄位（不得宣稱為 runtime 有效）"
    }
  },
  "additionalProperties": false
}
